{
  "fixtureID": "heldout-synth-014",
  "domainTags": [
    "人际"
  ],
  "sources": [
    {
      "sourceID": "thought-14-1",
      "sourceDomain": "thought",
      "sourceKind": "userNote",
      "plainText": "下周末的事：准备与姐姐的一次重要沟通。姐姐之前提过要静养休息，记着这点。",
      "recordedAt": "2026-08-20T21:00:00+08:00",
      "revisionDigest": "rev-14-1"
    },
    {
      "sourceID": "conv-14-2",
      "sourceDomain": "conversation",
      "sourceKind": "chatMessage",
      "role": "user",
      "plainText": "留学申请的事是我自己负责的，不用别人代管。",
      "recordedAt": "2026-08-25T20:00:00+08:00",
      "revisionDigest": "rev-14-2"
    }
  ],
  "currentRequest": {
    "utterance": "准备与姐姐的一次重要沟通",
    "goalSummary": "准备与姐姐的一次重要沟通",
    "referenceTime": "2026-09-07T12:00:00+08:00"
  },
  "expectedSupportedRelations": [
    {
      "statement": "用户需要在下周末处理：准备与姐姐的一次重要沟通",
      "basisSourceIDs": [
        "thought-14-1"
      ],
      "epistemicStatus": "declared"
    },
    {
      "statement": "姐姐方面要注意静养休息",
      "basisSourceIDs": [
        "thought-14-1"
      ],
      "epistemicStatus": "declared"
    }
  ],
  "unknowns": [
    "姐姐的具体时间",
    "留学申请的细节"
  ],
  "expectedPlanEffects": [
    {
      "effectKind": "shouldInclude",
      "description": "方案应考虑静养休息"
    },
    {
      "effectKind": "shouldAsk",
      "description": "未知事项应先询问"
    }
  ],
  "forbiddenClaims": [
    "姐姐已确认全部安排",
    "已替用户完成操作"
  ],
  "counterfactualVariants": [
    {
      "variantID": "cf-1",
      "change": "删除 thought-14-1",
      "expectedEffect": "静养休息相关建议消失或转为未知"
    },
    {
      "variantID": "cf-2",
      "change": "conv-14-2 改为 role: assistant",
      "expectedEffect": "助手消息不可作为用户事实"
    }
  ]
}
