{
  "fixtureID": "heldout-synth-033",
  "domainTags": [
    "财务"
  ],
  "sources": [
    {
      "sourceID": "thought-33-1",
      "sourceDomain": "thought",
      "sourceKind": "userNote",
      "plainText": "上个月的事：梳理上个月的必要支出。孩子之前提过要错峰出行，记着这点。",
      "recordedAt": "2026-08-20T21:00:00+08:00",
      "revisionDigest": "rev-33-1"
    },
    {
      "sourceID": "conv-33-2",
      "sourceDomain": "conversation",
      "sourceKind": "chatMessage",
      "role": "user",
      "plainText": "留学申请的事是我自己负责的，不用别人代管。",
      "recordedAt": "2026-08-25T20:00:00+08:00",
      "revisionDigest": "rev-33-2"
    }
  ],
  "currentRequest": {
    "utterance": "梳理上个月的必要支出",
    "goalSummary": "梳理上个月的必要支出",
    "referenceTime": "2026-09-07T12:00:00+08:00"
  },
  "expectedSupportedRelations": [
    {
      "statement": "用户需要在上个月处理：梳理上个月的必要支出",
      "basisSourceIDs": [
        "thought-33-1"
      ],
      "epistemicStatus": "declared"
    },
    {
      "statement": "孩子方面要注意错峰出行",
      "basisSourceIDs": [
        "thought-33-1"
      ],
      "epistemicStatus": "declared"
    }
  ],
  "unknowns": [
    "孩子的具体时间",
    "留学申请的细节"
  ],
  "expectedPlanEffects": [
    {
      "effectKind": "shouldInclude",
      "description": "方案应考虑错峰出行"
    },
    {
      "effectKind": "shouldAsk",
      "description": "未知事项应先询问"
    }
  ],
  "forbiddenClaims": [
    "孩子已确认全部安排",
    "已替用户完成操作"
  ],
  "counterfactualVariants": [
    {
      "variantID": "cf-1",
      "change": "删除 thought-33-1",
      "expectedEffect": "错峰出行相关建议消失或转为未知"
    },
    {
      "variantID": "cf-2",
      "change": "conv-33-2 改为 role: assistant",
      "expectedEffect": "助手消息不可作为用户事实"
    }
  ]
}
