{
  "fixtureID": "heldout-synth-028",
  "domainTags": [
    "人际"
  ],
  "sources": [
    {
      "sourceID": "thought-28-1",
      "sourceDomain": "thought",
      "sourceKind": "userNote",
      "plainText": "十一假期的事：准备与父亲的一次重要沟通。父亲之前提过要减少熬夜，记着这点。",
      "recordedAt": "2026-08-20T21:00:00+08:00",
      "revisionDigest": "rev-28-1"
    },
    {
      "sourceID": "conv-28-2",
      "sourceDomain": "conversation",
      "sourceKind": "chatMessage",
      "role": "user",
      "plainText": "房贷的事是我自己负责的，不用别人代管。",
      "recordedAt": "2026-08-25T20:00:00+08:00",
      "revisionDigest": "rev-28-2"
    }
  ],
  "currentRequest": {
    "utterance": "准备与父亲的一次重要沟通",
    "goalSummary": "准备与父亲的一次重要沟通",
    "referenceTime": "2026-09-07T12:00:00+08:00"
  },
  "expectedSupportedRelations": [
    {
      "statement": "用户需要在十一假期处理：准备与父亲的一次重要沟通",
      "basisSourceIDs": [
        "thought-28-1"
      ],
      "epistemicStatus": "declared"
    },
    {
      "statement": "父亲方面要注意减少熬夜",
      "basisSourceIDs": [
        "thought-28-1"
      ],
      "epistemicStatus": "declared"
    }
  ],
  "unknowns": [
    "父亲的具体时间",
    "房贷的细节"
  ],
  "expectedPlanEffects": [
    {
      "effectKind": "shouldInclude",
      "description": "方案应考虑减少熬夜"
    },
    {
      "effectKind": "shouldAsk",
      "description": "未知事项应先询问"
    }
  ],
  "forbiddenClaims": [
    "父亲已确认全部安排",
    "已替用户完成操作"
  ],
  "counterfactualVariants": [
    {
      "variantID": "cf-1",
      "change": "删除 thought-28-1",
      "expectedEffect": "减少熬夜相关建议消失或转为未知"
    },
    {
      "variantID": "cf-2",
      "change": "conv-28-2 改为 role: assistant",
      "expectedEffect": "助手消息不可作为用户事实"
    }
  ]
}
