{
  "fixtureID": "heldout-synth-025",
  "domainTags": [
    "健康"
  ],
  "sources": [
    {
      "sourceID": "thought-25-1",
      "sourceDomain": "thought",
      "sourceKind": "userNote",
      "plainText": "月底前的事：调整近期的生活作息。同事小周之前提过要减少熬夜，记着这点。",
      "recordedAt": "2026-08-20T21:00:00+08:00",
      "revisionDigest": "rev-25-1"
    },
    {
      "sourceID": "conv-25-2",
      "sourceDomain": "conversation",
      "sourceKind": "chatMessage",
      "role": "user",
      "plainText": "健身计划的事是我自己负责的，不用别人代管。",
      "recordedAt": "2026-08-25T20:00:00+08:00",
      "revisionDigest": "rev-25-2"
    }
  ],
  "currentRequest": {
    "utterance": "调整近期的生活作息",
    "goalSummary": "调整近期的生活作息",
    "referenceTime": "2026-09-07T12:00:00+08:00"
  },
  "expectedSupportedRelations": [
    {
      "statement": "用户需要在月底前处理：调整近期的生活作息",
      "basisSourceIDs": [
        "thought-25-1"
      ],
      "epistemicStatus": "declared"
    },
    {
      "statement": "同事小周方面要注意减少熬夜",
      "basisSourceIDs": [
        "thought-25-1"
      ],
      "epistemicStatus": "declared"
    }
  ],
  "unknowns": [
    "同事小周的具体时间",
    "健身计划的细节"
  ],
  "expectedPlanEffects": [
    {
      "effectKind": "shouldInclude",
      "description": "方案应考虑减少熬夜"
    },
    {
      "effectKind": "shouldAsk",
      "description": "未知事项应先询问"
    }
  ],
  "forbiddenClaims": [
    "同事小周已确认全部安排",
    "已替用户完成操作"
  ],
  "counterfactualVariants": [
    {
      "variantID": "cf-1",
      "change": "删除 thought-25-1",
      "expectedEffect": "减少熬夜相关建议消失或转为未知"
    },
    {
      "variantID": "cf-2",
      "change": "conv-25-2 改为 role: assistant",
      "expectedEffect": "助手消息不可作为用户事实"
    }
  ]
}
