{
  "fixtureID": "heldout-synth-035",
  "domainTags": [
    "人际"
  ],
  "sources": [
    {
      "sourceID": "thought-35-1",
      "sourceDomain": "thought",
      "sourceKind": "userNote",
      "plainText": "明年一月的事：准备与母亲的一次重要沟通。母亲之前提过要控制预算，记着这点。",
      "recordedAt": "2026-08-20T21:00:00+08:00",
      "revisionDigest": "rev-35-1"
    },
    {
      "sourceID": "conv-35-2",
      "sourceDomain": "conversation",
      "sourceKind": "chatMessage",
      "role": "user",
      "plainText": "驾照考试的事是我自己负责的，不用别人代管。",
      "recordedAt": "2026-08-25T20:00:00+08:00",
      "revisionDigest": "rev-35-2"
    }
  ],
  "currentRequest": {
    "utterance": "准备与母亲的一次重要沟通",
    "goalSummary": "准备与母亲的一次重要沟通",
    "referenceTime": "2026-09-07T12:00:00+08:00"
  },
  "expectedSupportedRelations": [
    {
      "statement": "用户需要在明年一月处理：准备与母亲的一次重要沟通",
      "basisSourceIDs": [
        "thought-35-1"
      ],
      "epistemicStatus": "declared"
    },
    {
      "statement": "母亲方面要注意控制预算",
      "basisSourceIDs": [
        "thought-35-1"
      ],
      "epistemicStatus": "declared"
    }
  ],
  "unknowns": [
    "母亲的具体时间",
    "驾照考试的细节"
  ],
  "expectedPlanEffects": [
    {
      "effectKind": "shouldInclude",
      "description": "方案应考虑控制预算"
    },
    {
      "effectKind": "shouldAsk",
      "description": "未知事项应先询问"
    }
  ],
  "forbiddenClaims": [
    "母亲已确认全部安排",
    "已替用户完成操作"
  ],
  "counterfactualVariants": [
    {
      "variantID": "cf-1",
      "change": "删除 thought-35-1",
      "expectedEffect": "控制预算相关建议消失或转为未知"
    },
    {
      "variantID": "cf-2",
      "change": "conv-35-2 改为 role: assistant",
      "expectedEffect": "助手消息不可作为用户事实"
    }
  ]
}
